[2025-04-14 15:21:48] INFO - Started sniffing.
[2025-04-14 15:21:51] INFO - Received Packet-1: Ether / IP / TCP 172.65.235.85:5588 > 192.168.1.5:55441 PA / Raw
[2025-04-14 15:21:51] INFO - Received Packet-2: Ether / IP / TCP 172.65.235.85:5588 > 192.168.1.5:55441 PA / Raw
[2025-04-14 15:21:52] INFO - Received Packet-3: Ether / IP / TCP 172.65.235.85:5588 > 192.168.1.5:55441 PA / Raw
[2025-04-14 15:21:52] INFO - Received Packet-4: Ether / IP / TCP 172.65.235.85:5588 > 192.168.1.5:55441 PA / Raw
[2025-04-14 15:21:52] INFO - Received Packet-5: Ether / IP / TCP 172.65.235.85:5588 > 192.168.1.5:55441 PA / Raw
[2025-04-14 15:21:54] INFO - Received Packet-6: Ether / IP / TCP 172.65.235.85:5588 > 192.168.1.5:55568 PA / Raw
[2025-04-14 15:21:54] INFO - Received Packet-7: Ether / IP / TCP 172.65.235.85:5588 > 192.168.1.5:55568 PA / Raw
[2025-04-14 15:21:54] INFO - Received Packet-8: Ether / IP / TCP 172.65.235.85:5588 > 192.168.1.5:55568 PA / Raw
[2025-04-14 15:21:54] INFO - Received Packet-9: Ether / IP / TCP 172.65.235.85:5588 > 192.168.1.5:55568 PA / Raw
[2025-04-14 15:21:55] INFO - Received Packet-10: Ether / IP / TCP 172.65.235.85:5588 > 192.168.1.5:55568 PA / Raw
[2025-04-14 15:21:55] INFO - Received Packet-11: Ether / IP / TCP 172.65.235.85:5588 > 192.168.1.5:55568 PA / Raw
[2025-04-14 15:21:55] INFO - Received Packet-12: Ether / IP / TCP 172.65.235.85:5588 > 192.168.1.5:55568 PA / Raw
[2025-04-14 15:21:55] INFO - Received Packet-13: Ether / IP / TCP 172.65.235.85:5588 > 192.168.1.5:55568 PA / Raw
[2025-04-14 15:21:55] INFO - Received Packet-14: Ether / IP / TCP 172.65.235.85:5588 > 192.168.1.5:55568 A / Raw
[2025-04-14 15:21:55] INFO - Received Packet-15: Ether / IP / TCP 172.65.235.85:5588 > 192.168.1.5:55568 PA / Raw
[2025-04-14 15:21:55] INFO - Received Packet-16: Ether / IP / TCP 172.65.235.85:5588 > 192.168.1.5:55568 A / Raw
[2025-04-14 15:21:55] INFO - Received Packet-17: Ether / IP / TCP 172.65.235.85:5588 > 192.168.1.5:55568 A / Raw
[2025-04-14 15:21:55] INFO - Received Packet-18: Ether / IP / TCP 172.65.235.85:5588 > 192.168.1.5:55568 PA / Raw
[2025-04-14 15:21:55] INFO - Received Packet-19: Ether / IP / TCP 172.65.235.85:5588 > 192.168.1.5:55568 PA / Raw
[2025-04-14 15:21:56] INFO - Received Packet-20: Ether / IP / TCP 172.65.235.85:5588 > 192.168.1.5:55568 PA / Raw
[2025-04-14 15:21:56] INFO - Received Packet-21: Ether / IP / TCP 172.65.235.85:5588 > 192.168.1.5:55568 PA / Raw
[2025-04-14 15:21:56] INFO - Received Packet-22: Ether / IP / TCP 172.65.235.85:5588 > 192.168.1.5:55568 PA / Raw
[2025-04-14 15:21:56] INFO - Received Packet-23: Ether / IP / TCP 172.65.235.85:5588 > 192.168.1.5:55568 A / Raw
[2025-04-14 15:21:56] INFO - Received Packet-24: Ether / IP / TCP 172.65.235.85:5588 > 192.168.1.5:55568 PA / Raw
[2025-04-14 15:21:56] INFO - Received Packet-25: Ether / IP / TCP 172.65.235.85:5588 > 192.168.1.5:55568 PA / Raw
[2025-04-14 15:21:56] INFO - Received Packet-26: Ether / IP / TCP 172.65.235.85:5588 > 192.168.1.5:55568 A / Raw
[2025-04-14 15:21:56] INFO - Received Packet-27: Ether / IP / TCP 172.65.235.85:5588 > 192.168.1.5:55568 PA / Raw
[2025-04-14 15:21:56] INFO - Received Packet-28: Ether / IP / TCP 172.65.235.85:5588 > 192.168.1.5:55568 A / Raw
[2025-04-14 15:21:56] INFO - Received Packet-29: Ether / IP / TCP 172.65.235.85:5588 > 192.168.1.5:55568 PA / Raw
[2025-04-14 15:21:56] INFO - Received Packet-30: Ether / IP / TCP 172.65.235.85:5588 > 192.168.1.5:55568 PA / Raw
[2025-04-14 15:21:56] INFO - Received Packet-31: Ether / IP / TCP 172.65.235.85:5588 > 192.168.1.5:55568 A / Raw
[2025-04-14 15:21:56] INFO - Received Packet-32: Ether / IP / TCP 172.65.235.85:5588 > 192.168.1.5:55568 PA / Raw
[2025-04-14 15:21:56] INFO - Received Packet-33: Ether / IP / TCP 172.65.235.85:5588 > 192.168.1.5:55568 A / Raw
[2025-04-14 15:21:56] INFO - Received Packet-34: Ether / IP / TCP 172.65.235.85:5588 > 192.168.1.5:55568 PA / Raw
[2025-04-14 15:21:56] INFO - Received Packet-35: Ether / IP / TCP 172.65.235.85:5588 > 192.168.1.5:55568 A / Raw
[2025-04-14 15:21:56] INFO - Received Packet-36: Ether / IP / TCP 172.65.235.85:5588 > 192.168.1.5:55568 PA / Raw
[2025-04-14 15:21:56] INFO - Received Packet-37: Ether / IP / TCP 172.65.235.85:5588 > 192.168.1.5:55568 PA / Raw
[2025-04-14 15:21:56] INFO - Received Packet-38: Ether / IP / TCP 172.65.235.85:5588 > 192.168.1.5:55568 PA / Raw
[2025-04-14 15:21:56] INFO - Received Packet-39: Ether / IP / TCP 172.65.235.85:5588 > 192.168.1.5:55568 A / Raw
[2025-04-14 15:21:56] INFO - Received Packet-40: Ether / IP / TCP 172.65.235.85:5588 > 192.168.1.5:55568 PA / Raw
[2025-04-14 15:21:56] INFO - Received Packet-41: Ether / IP / TCP 172.65.235.85:5588 > 192.168.1.5:55568 PA / Raw
[2025-04-14 15:21:56] INFO - Received Packet-42: Ether / IP / TCP 172.65.235.85:5588 > 192.168.1.5:55568 A / Raw
[2025-04-14 15:21:56] INFO - Received Packet-43: Ether / IP / TCP 172.65.235.85:5588 > 192.168.1.5:55568 PA / Raw
[2025-04-14 15:21:56] INFO - Received Packet-44: Ether / IP / TCP 172.65.235.85:5588 > 192.168.1.5:55568 PA / Raw
[2025-04-14 15:21:56] INFO - Received Packet-45: Ether / IP / TCP 172.65.235.85:5588 > 192.168.1.5:55568 A / Raw
[2025-04-14 15:21:56] INFO - Received Packet-46: Ether / IP / TCP 172.65.235.85:5588 > 192.168.1.5:55568 A / Raw
[2025-04-14 15:21:56] INFO - Received Packet-47: Ether / IP / TCP 172.65.235.85:5588 > 192.168.1.5:55568 PA / Raw
[2025-04-14 15:21:56] INFO - Received Packet-48: Ether / IP / TCP 172.65.235.85:5588 > 192.168.1.5:55568 PA / Raw
[2025-04-14 15:21:56] INFO - Received Packet-49: Ether / IP / TCP 172.65.235.85:5588 > 192.168.1.5:55568 A / Raw
[2025-04-14 15:21:56] INFO - Received Packet-50: Ether / IP / TCP 172.65.235.85:5588 > 192.168.1.5:55568 PA / Raw
[2025-04-14 15:21:56] INFO - Received Packet-51: Ether / IP / TCP 172.65.235.85:5588 > 192.168.1.5:55568 PA / Raw
[2025-04-14 15:21:56] INFO - Received Packet-52: Ether / IP / TCP 172.65.235.85:5588 > 192.168.1.5:55568 A / Raw
[2025-04-14 15:21:56] INFO - Received Packet-53: Ether / IP / TCP 172.65.235.85:5588 > 192.168.1.5:55568 PA / Raw
[2025-04-14 15:21:56] INFO - Received Packet-54: Ether / IP / TCP 172.65.235.85:5588 > 192.168.1.5:55568 A / Raw
[2025-04-14 15:21:56] INFO - Received Packet-55: Ether / IP / TCP 172.65.235.85:5588 > 192.168.1.5:55568 PA / Raw
[2025-04-14 15:21:56] INFO - Received Packet-56: Ether / IP / TCP 172.65.235.85:5588 > 192.168.1.5:55568 A / Raw
[2025-04-14 15:21:56] INFO - Received Packet-57: Ether / IP / TCP 172.65.235.85:5588 > 192.168.1.5:55568 PA / Raw
[2025-04-14 15:21:56] INFO - Received Packet-58: Ether / IP / TCP 172.65.235.85:5588 > 192.168.1.5:55568 A / Raw
[2025-04-14 15:21:56] INFO - Received Packet-59: Ether / IP / TCP 172.65.235.85:5588 > 192.168.1.5:55568 PA / Raw
[2025-04-14 15:21:56] INFO - Received Packet-60: Ether / IP / TCP 172.65.235.85:5588 > 192.168.1.5:55568 A / Raw
[2025-04-14 15:21:56] INFO - Received Packet-61: Ether / IP / TCP 172.65.235.85:5588 > 192.168.1.5:55568 PA / Raw
[2025-04-14 15:21:59] INFO - Received Packet-62: Ether / IP / TCP 172.65.235.85:5588 > 192.168.1.5:55568 PA / Raw
[2025-04-14 15:21:59] INFO - Received Packet-63: Ether / IP / TCP 172.65.235.85:5588 > 192.168.1.5:55568 PA / Raw
[2025-04-14 15:22:02] INFO - Received Packet-64: Ether / IP / TCP 172.65.235.85:5588 > 192.168.1.5:55568 PA / Raw
[2025-04-14 15:22:02] INFO - Received Packet-65: Ether / IP / TCP 172.65.235.85:5588 > 192.168.1.5:55568 PA / Raw
[2025-04-14 15:22:05] INFO - Received Packet-66: Ether / IP / TCP 172.65.235.85:5588 > 192.168.1.5:55568 PA / Raw
[2025-04-14 15:22:05] INFO - Received Packet-67: Ether / IP / TCP 172.65.235.85:5588 > 192.168.1.5:55568 PA / Raw
[2025-04-14 15:22:07] INFO - Received Packet-68: Ether / IP / TCP 172.65.235.85:5588 > 192.168.1.5:55568 PA / Raw
[2025-04-14 15:22:09] INFO - Received Packet-69: Ether / IP / TCP 172.65.235.85:5588 > 192.168.1.5:55568 PA / Raw
[2025-04-14 15:22:10] INFO - Received Packet-70: Ether / IP / TCP 172.65.235.85:5588 > 192.168.1.5:55568 PA / Raw
[2025-04-14 15:22:10] INFO - Received Packet-71: Ether / IP / TCP 172.65.235.85:5588 > 192.168.1.5:55568 PA / Raw
[2025-04-14 15:22:12] INFO - Received Packet-72: Ether / IP / TCP 172.65.235.85:5588 > 192.168.1.5:55570 PA / Raw
[2025-04-14 15:22:12] INFO - Received Packet-73: Ether / IP / TCP 172.65.235.85:5588 > 192.168.1.5:55570 PA / Raw
[2025-04-14 15:22:12] INFO - Received Packet-74: Ether / IP / TCP 172.65.235.85:5588 > 192.168.1.5:55570 PA / Raw
[2025-04-14 15:22:12] INFO - Received Packet-75: Ether / IP / TCP 172.65.235.85:5588 > 192.168.1.5:55570 PA / Raw
[2025-04-14 15:22:13] INFO - Received Packet-76: Ether / IP / TCP 172.65.235.85:5588 > 192.168.1.5:55570 PA / Raw
[2025-04-14 15:22:13] INFO - Received Packet-77: Ether / IP / TCP 172.65.235.85:5588 > 192.168.1.5:55570 PA / Raw
[2025-04-14 15:22:13] INFO - Received Packet-78: Ether / IP / TCP 172.65.235.85:5588 > 192.168.1.5:55570 PA / Raw
[2025-04-14 15:22:13] INFO - Received Packet-79: Ether / IP / TCP 172.65.235.85:5588 > 192.168.1.5:55570 PA / Raw
[2025-04-14 15:22:14] INFO - Received Packet-80: Ether / IP / TCP 172.65.235.85:5588 > 192.168.1.5:55570 PA / Raw
[2025-04-14 15:22:14] INFO - Received Packet-81: Ether / IP / TCP 172.65.235.85:5588 > 192.168.1.5:55570 A / Raw
[2025-04-14 15:22:14] INFO - Received Packet-82: Ether / IP / TCP 172.65.235.85:5588 > 192.168.1.5:55570 PA / Raw
[2025-04-14 15:22:14] INFO - Received Packet-83: Ether / IP / TCP 172.65.235.85:5588 > 192.168.1.5:55570 A / Raw
[2025-04-14 15:22:14] INFO - Received Packet-84: Ether / IP / TCP 172.65.235.85:5588 > 192.168.1.5:55570 PA / Raw
[2025-04-14 15:22:14] INFO - Received Packet-85: Ether / IP / TCP 172.65.235.85:5588 > 192.168.1.5:55570 PA / Raw
[2025-04-14 15:22:14] INFO - Received Packet-86: Ether / IP / TCP 172.65.235.85:5588 > 192.168.1.5:55570 PA / Raw
[2025-04-14 15:22:14] INFO - Received Packet-87: Ether / IP / TCP 172.65.235.85:5588 > 192.168.1.5:55570 A / Raw
[2025-04-14 15:22:14] INFO - Received Packet-88: Ether / IP / TCP 172.65.235.85:5588 > 192.168.1.5:55570 PA / Raw
[2025-04-14 15:22:14] INFO - Received Packet-89: Ether / IP / TCP 172.65.235.85:5588 > 192.168.1.5:55570 PA / Raw
[2025-04-14 15:22:14] INFO - Received Packet-90: Ether / IP / TCP 172.65.235.85:5588 > 192.168.1.5:55570 PA / Raw
[2025-04-14 15:22:14] INFO - Received Packet-91: Ether / IP / TCP 172.65.235.85:5588 > 192.168.1.5:55570 PA / Raw
[2025-04-14 15:22:14] INFO - Received Packet-92: Ether / IP / TCP 172.65.235.85:5588 > 192.168.1.5:55570 PA / Raw
[2025-04-14 15:22:14] INFO - Received Packet-93: Ether / IP / TCP 172.65.235.85:5588 > 192.168.1.5:55570 PA / Raw
[2025-04-14 15:22:14] INFO - Received Packet-94: Ether / IP / TCP 172.65.235.85:5588 > 192.168.1.5:55570 PA / Raw
[2025-04-14 15:22:14] INFO - Received Packet-95: Ether / IP / TCP 172.65.235.85:5588 > 192.168.1.5:55570 A / Raw
[2025-04-14 15:22:14] INFO - Received Packet-96: Ether / IP / TCP 172.65.235.85:5588 > 192.168.1.5:55570 PA / Raw
[2025-04-14 15:22:14] INFO - Received Packet-97: Ether / IP / TCP 172.65.235.85:5588 > 192.168.1.5:55570 A / Raw
[2025-04-14 15:22:14] INFO - Received Packet-98: Ether / IP / TCP 172.65.235.85:5588 > 192.168.1.5:55570 PA / Raw
[2025-04-14 15:22:14] INFO - Received Packet-99: Ether / IP / TCP 172.65.235.85:5588 > 192.168.1.5:55570 PA / Raw
[2025-04-14 15:22:14] INFO - Received Packet-100: Ether / IP / TCP 172.65.235.85:5588 > 192.168.1.5:55570 A / Raw
[2025-04-14 15:22:14] INFO - Received Packet-101: Ether / IP / TCP 172.65.235.85:5588 > 192.168.1.5:55570 PA / Raw
[2025-04-14 15:22:14] INFO - Received Packet-102: Ether / IP / TCP 172.65.235.85:5588 > 192.168.1.5:55570 PA / Raw
[2025-04-14 15:22:14] INFO - Received Packet-103: Ether / IP / TCP 172.65.235.85:5588 > 192.168.1.5:55570 A / Raw
[2025-04-14 15:22:14] INFO - Received Packet-104: Ether / IP / TCP 172.65.235.85:5588 > 192.168.1.5:55570 PA / Raw
[2025-04-14 15:22:14] INFO - Received Packet-105: Ether / IP / TCP 172.65.235.85:5588 > 192.168.1.5:55570 PA / Raw
[2025-04-14 15:22:14] INFO - Received Packet-106: Ether / IP / TCP 172.65.235.85:5588 > 192.168.1.5:55570 PA / Raw
[2025-04-14 15:22:14] INFO - Received Packet-107: Ether / IP / TCP 172.65.235.85:5588 > 192.168.1.5:55570 PA / Raw
[2025-04-14 15:22:14] INFO - Received Packet-108: Ether / IP / TCP 172.65.235.85:5588 > 192.168.1.5:55570 PA / Raw
[2025-04-14 15:22:14] INFO - Received Packet-109: Ether / IP / TCP 172.65.235.85:5588 > 192.168.1.5:55570 PA / Raw
[2025-04-14 15:22:14] INFO - Received Packet-110: Ether / IP / TCP 172.65.235.85:5588 > 192.168.1.5:55570 PA / Raw
[2025-04-14 15:22:14] INFO - Received Packet-111: Ether / IP / TCP 172.65.235.85:5588 > 192.168.1.5:55570 PA / Raw
[2025-04-14 15:22:14] INFO - Received Packet-112: Ether / IP / TCP 172.65.235.85:5588 > 192.168.1.5:55570 PA / Raw
[2025-04-14 15:22:14] INFO - Received Packet-113: Ether / IP / TCP 172.65.235.85:5588 > 192.168.1.5:55570 PA / Raw
[2025-04-14 15:22:14] INFO - Received Packet-114: Ether / IP / TCP 172.65.235.85:5588 > 192.168.1.5:55570 PA / Raw
[2025-04-14 15:22:14] INFO - Received Packet-115: Ether / IP / TCP 172.65.235.85:5588 > 192.168.1.5:55570 PA / Raw
[2025-04-14 15:22:14] INFO - Received Packet-116: Ether / IP / TCP 172.65.235.85:5588 > 192.168.1.5:55570 PA / Raw
[2025-04-14 15:22:18] INFO - Received Packet-117: Ether / IP / TCP 172.65.235.85:5588 > 192.168.1.5:55570 PA / Raw
[2025-04-14 15:22:18] INFO - Received Packet-118: Ether / IP / TCP 172.65.235.85:5588 > 192.168.1.5:55570 PA / Raw
[2025-04-14 15:22:18] INFO - Received Packet-119: Ether / IP / TCP 172.65.235.85:5588 > 192.168.1.5:55570 PA / Raw
[2025-04-14 15:22:18] INFO - Received Packet-120: Ether / IP / TCP 172.65.235.85:5588 > 192.168.1.5:55570 PA / Raw
[2025-04-14 15:22:18] INFO - Received Packet-121: Ether / IP / TCP 172.65.235.85:5588 > 192.168.1.5:55570 PA / Raw
[2025-04-14 15:22:18] INFO - Received Packet-122: Ether / IP / TCP 172.65.235.85:5588 > 192.168.1.5:55570 PA / Raw
[2025-04-14 15:22:20] INFO - Received Packet-123: Ether / IP / TCP 172.65.235.85:5588 > 192.168.1.5:55570 PA / Raw
[2025-04-14 15:22:21] INFO - Received Packet-124: Ether / IP / TCP 172.65.235.85:5588 > 192.168.1.5:55570 PA / Raw
[2025-04-14 15:22:21] INFO - Received Packet-125: Ether / IP / TCP 172.65.235.85:5588 > 192.168.1.5:55570 PA / Raw
[2025-04-14 15:22:23] INFO - Received Packet-126: Ether / IP / TCP 172.65.235.85:5589 > 192.168.1.5:55574 PA / Raw
[2025-04-14 15:22:23] INFO - Received Packet-127: Ether / IP / TCP 172.65.235.85:5589 > 192.168.1.5:55575 PA / Raw
[2025-04-14 15:22:23] INFO - Received Packet-128: Ether / IP / TCP 172.65.235.85:5589 > 192.168.1.5:55575 PA / Raw
[2025-04-14 15:22:24] INFO - Received Packet-129: Ether / IP / TCP 172.65.235.85:5589 > 192.168.1.5:55575 PA / Raw
[2025-04-14 15:22:24] INFO - Received Packet-130: Ether / IP / TCP 172.65.235.85:5589 > 192.168.1.5:55575 PA / Raw
[2025-04-14 15:22:24] INFO - Received Packet-131: Ether / IP / TCP 172.65.235.85:5589 > 192.168.1.5:55575 PA / Raw
[2025-04-14 15:22:25] INFO - Received Packet-132: Ether / IP / TCP 172.65.235.85:5589 > 192.168.1.5:55575 PA / Raw
[2025-04-14 15:22:25] INFO - Received Packet-133: Ether / IP / TCP 172.65.235.85:5589 > 192.168.1.5:55575 PA / Raw
[2025-04-14 15:22:26] INFO - Received Packet-134: Ether / IP / TCP 172.65.235.85:5589 > 192.168.1.5:55575 PA / Raw
[2025-04-14 15:22:26] INFO - Received Packet-135: Ether / IP / TCP 172.65.235.85:5589 > 192.168.1.5:55575 A / Raw
[2025-04-14 15:22:26] INFO - Received Packet-136: Ether / IP / TCP 172.65.235.85:5589 > 192.168.1.5:55575 PA / Raw
[2025-04-14 15:22:26] INFO - Received Packet-137: Ether / IP / TCP 172.65.235.85:5589 > 192.168.1.5:55575 A / Raw
[2025-04-14 15:22:26] INFO - Received Packet-138: Ether / IP / TCP 172.65.235.85:5589 > 192.168.1.5:55575 PA / Raw
[2025-04-14 15:22:26] INFO - Received Packet-139: Ether / IP / TCP 172.65.235.85:5589 > 192.168.1.5:55575 PA / Raw
[2025-04-14 15:22:26] INFO - Received Packet-140: Ether / IP / TCP 172.65.235.85:5589 > 192.168.1.5:55575 PA / Raw
[2025-04-14 15:22:26] INFO - Received Packet-141: Ether / IP / TCP 172.65.235.85:5589 > 192.168.1.5:55575 PA / Raw
[2025-04-14 15:22:26] INFO - Received Packet-142: Ether / IP / TCP 172.65.235.85:5589 > 192.168.1.5:55575 PA / Raw
[2025-04-14 15:22:26] INFO - Received Packet-143: Ether / IP / TCP 172.65.235.85:5589 > 192.168.1.5:55575 PA / Raw
[2025-04-14 15:22:26] INFO - Received Packet-144: Ether / IP / TCP 172.65.235.85:5589 > 192.168.1.5:55575 A / Raw
[2025-04-14 15:22:26] INFO - Received Packet-145: Ether / IP / TCP 172.65.235.85:5589 > 192.168.1.5:55575 PA / Raw
[2025-04-14 15:22:26] INFO - Received Packet-146: Ether / IP / TCP 172.65.235.85:5589 > 192.168.1.5:55575 A / Raw
[2025-04-14 15:22:26] INFO - Received Packet-147: Ether / IP / TCP 172.65.235.85:5589 > 192.168.1.5:55575 PA / Raw
[2025-04-14 15:22:26] INFO - Received Packet-148: Ether / IP / TCP 172.65.235.85:5589 > 192.168.1.5:55575 PA / Raw
[2025-04-14 15:22:26] INFO - Received Packet-149: Ether / IP / TCP 172.65.235.85:5589 > 192.168.1.5:55575 A / Raw
[2025-04-14 15:22:26] INFO - Received Packet-150: Ether / IP / TCP 172.65.235.85:5589 > 192.168.1.5:55575 PA / Raw
[2025-04-14 15:22:26] INFO - Received Packet-151: Ether / IP / TCP 172.65.235.85:5589 > 192.168.1.5:55575 PA / Raw
[2025-04-14 15:22:26] INFO - Received Packet-152: Ether / IP / TCP 172.65.235.85:5589 > 192.168.1.5:55575 PA / Raw
[2025-04-14 15:22:26] INFO - Received Packet-153: Ether / IP / TCP 172.65.235.85:5589 > 192.168.1.5:55575 PA / Raw
[2025-04-14 15:22:26] INFO - Received Packet-154: Ether / IP / TCP 172.65.235.85:5589 > 192.168.1.5:55575 PA / Raw
[2025-04-14 15:22:26] INFO - Received Packet-155: Ether / IP / TCP 172.65.235.85:5589 > 192.168.1.5:55575 PA / Raw
[2025-04-14 15:22:26] INFO - Received Packet-156: Ether / IP / TCP 172.65.235.85:5589 > 192.168.1.5:55575 PA / Raw
[2025-04-14 15:22:26] INFO - Received Packet-157: Ether / IP / TCP 172.65.235.85:5589 > 192.168.1.5:55575 A / Raw
[2025-04-14 15:22:26] INFO - Received Packet-158: Ether / IP / TCP 172.65.235.85:5589 > 192.168.1.5:55575 PA / Raw
[2025-04-14 15:22:26] INFO - Received Packet-159: Ether / IP / TCP 172.65.235.85:5589 > 192.168.1.5:55575 PA / Raw
[2025-04-14 15:22:26] INFO - Received Packet-160: Ether / IP / TCP 172.65.235.85:5589 > 192.168.1.5:55575 A / Raw
[2025-04-14 15:22:26] INFO - Received Packet-161: Ether / IP / TCP 172.65.235.85:5589 > 192.168.1.5:55575 PA / Raw
[2025-04-14 15:22:26] INFO - Received Packet-162: Ether / IP / TCP 172.65.235.85:5589 > 192.168.1.5:55575 PA / Raw
[2025-04-14 15:22:26] INFO - Received Packet-163: Ether / IP / TCP 172.65.235.85:5589 > 192.168.1.5:55575 A / Raw
[2025-04-14 15:22:26] INFO - Received Packet-164: Ether / IP / TCP 172.65.235.85:5589 > 192.168.1.5:55575 PA / Raw
[2025-04-14 15:22:26] INFO - Received Packet-165: Ether / IP / TCP 172.65.235.85:5589 > 192.168.1.5:55575 PA / Raw
[2025-04-14 15:22:26] INFO - Received Packet-166: Ether / IP / TCP 172.65.235.85:5589 > 192.168.1.5:55575 PA / Raw
[2025-04-14 15:22:26] INFO - Received Packet-167: Ether / IP / TCP 172.65.235.85:5589 > 192.168.1.5:55575 PA / Raw
[2025-04-14 15:22:26] INFO - Received Packet-168: Ether / IP / TCP 172.65.235.85:5589 > 192.168.1.5:55575 PA / Raw
[2025-04-14 15:22:26] INFO - Received Packet-169: Ether / IP / TCP 172.65.235.85:5589 > 192.168.1.5:55575 PA / Raw
[2025-04-14 15:22:26] INFO - Received Packet-170: Ether / IP / TCP 172.65.235.85:5589 > 192.168.1.5:55575 PA / Raw
[2025-04-14 15:22:26] INFO - Received Packet-171: Ether / IP / TCP 172.65.235.85:5589 > 192.168.1.5:55575 PA / Raw
[2025-04-14 15:22:26] INFO - Received Packet-172: Ether / IP / TCP 172.65.235.85:5589 > 192.168.1.5:55575 PA / Raw
[2025-04-14 15:22:26] INFO - Received Packet-173: Ether / IP / TCP 172.65.235.85:5589 > 192.168.1.5:55575 A / Raw
[2025-04-14 15:22:26] INFO - Received Packet-174: Ether / IP / TCP 172.65.235.85:5589 > 192.168.1.5:55575 PA / Raw
[2025-04-14 15:22:26] INFO - Received Packet-175: Ether / IP / TCP 172.65.235.85:5589 > 192.168.1.5:55575 PA / Raw
[2025-04-14 15:22:26] INFO - Received Packet-176: Ether / IP / TCP 172.65.235.85:5589 > 192.168.1.5:55575 A / Raw
[2025-04-14 15:22:26] INFO - Received Packet-177: Ether / IP / TCP 172.65.235.85:5589 > 192.168.1.5:55575 PA / Raw
[2025-04-14 15:22:26] INFO - Received Packet-178: Ether / IP / TCP 172.65.235.85:5589 > 192.168.1.5:55575 PA / Raw
[2025-04-14 15:22:26] INFO - Received Packet-179: Ether / IP / TCP 172.65.235.85:5589 > 192.168.1.5:55575 PA / Raw
[2025-04-14 15:22:30] INFO - Received Packet-180: Ether / IP / TCP 172.65.235.85:5589 > 192.168.1.5:55575 PA / Raw
[2025-04-14 15:22:30] INFO - Received Packet-181: Ether / IP / TCP 172.65.235.85:5589 > 192.168.1.5:55575 PA / Raw
[2025-04-14 15:22:30] INFO - Received Packet-182: Ether / IP / TCP 172.65.235.85:5589 > 192.168.1.5:55575 A / Raw
[2025-04-14 15:22:30] INFO - Received Packet-183: Ether / IP / TCP 172.65.235.85:5589 > 192.168.1.5:55575 PA / Raw
[2025-04-14 15:22:30] INFO - Received Packet-184: Ether / IP / TCP 172.65.235.85:5589 > 192.168.1.5:55575 PA / Raw
[2025-04-14 15:22:33] INFO - Received Packet-185: Ether / IP / TCP 172.65.235.85:5589 > 192.168.1.5:55575 PA / Raw
[2025-04-14 15:22:33] INFO - Received Packet-186: Ether / IP / TCP 172.65.235.85:5589 > 192.168.1.5:55575 A / Raw
[2025-04-14 15:22:33] INFO - Received Packet-187: Ether / IP / TCP 172.65.235.85:5589 > 192.168.1.5:55575 PA / Raw
[2025-04-14 15:22:33] INFO - Received Packet-188: Ether / IP / TCP 172.65.235.85:5589 > 192.168.1.5:55575 PA / Raw
[2025-04-14 15:22:33] INFO - Received Packet-189: Ether / IP / TCP 172.65.235.85:5589 > 192.168.1.5:55575 PA / Raw
[2025-04-14 15:22:34] INFO - Received Packet-190: Ether / IP / TCP 172.65.235.85:5589 > 192.168.1.5:55575 PA / Raw
[2025-04-14 15:22:36] INFO - Received Packet-191: Ether / IP / TCP 172.65.235.85:5589 > 192.168.1.5:55575 PA / Raw
[2025-04-14 15:22:36] INFO - Received Packet-192: Ether / IP / TCP 172.65.235.85:5589 > 192.168.1.5:55575 PA / Raw
[2025-04-14 15:22:37] INFO - Received Packet-193: Ether / IP / TCP 172.65.235.85:5588 > 192.168.1.5:55579 PA / Raw
[2025-04-14 15:22:37] INFO - Received Packet-194: Ether / IP / TCP 172.65.235.85:5588 > 192.168.1.5:55579 PA / Raw
[2025-04-14 15:22:37] INFO - Received Packet-195: Ether / IP / TCP 172.65.235.85:5588 > 192.168.1.5:55579 PA / Raw
[2025-04-14 15:22:37] INFO - Received Packet-196: Ether / IP / TCP 172.65.235.85:5588 > 192.168.1.5:55579 PA / Raw
[2025-04-14 15:22:38] INFO - Received Packet-197: Ether / IP / TCP 172.65.235.85:5588 > 192.168.1.5:55579 PA / Raw
[2025-04-14 15:22:38] INFO - Received Packet-198: Ether / IP / TCP 172.65.235.85:5588 > 192.168.1.5:55579 PA / Raw
[2025-04-14 15:22:39] INFO - Received Packet-199: Ether / IP / TCP 172.65.235.85:5588 > 192.168.1.5:55579 PA / Raw
[2025-04-14 15:22:39] INFO - Received Packet-200: Ether / IP / TCP 172.65.235.85:5588 > 192.168.1.5:55579 PA / Raw
[2025-04-14 15:22:40] INFO - Received Packet-201: Ether / IP / TCP 172.65.235.85:5588 > 192.168.1.5:55579 PA / Raw
[2025-04-14 15:22:40] INFO - Received Packet-202: Ether / IP / TCP 172.65.235.85:5588 > 192.168.1.5:55579 A / Raw
[2025-04-14 15:22:40] INFO - Received Packet-203: Ether / IP / TCP 172.65.235.85:5588 > 192.168.1.5:55579 PA / Raw
[2025-04-14 15:22:40] INFO - Received Packet-204: Ether / IP / TCP 172.65.235.85:5588 > 192.168.1.5:55579 A / Raw
[2025-04-14 15:22:40] INFO - Received Packet-205: Ether / IP / TCP 172.65.235.85:5588 > 192.168.1.5:55579 PA / Raw
[2025-04-14 15:22:40] INFO - Received Packet-206: Ether / IP / TCP 172.65.235.85:5588 > 192.168.1.5:55579 PA / Raw
[2025-04-14 15:22:40] INFO - Received Packet-207: Ether / IP / TCP 172.65.235.85:5588 > 192.168.1.5:55579 PA / Raw
[2025-04-14 15:22:40] INFO - Received Packet-208: Ether / IP / TCP 172.65.235.85:5588 > 192.168.1.5:55579 PA / Raw
[2025-04-14 15:22:40] INFO - Received Packet-209: Ether / IP / TCP 172.65.235.85:5588 > 192.168.1.5:55579 A / Raw
[2025-04-14 15:22:40] INFO - Received Packet-210: Ether / IP / TCP 172.65.235.85:5588 > 192.168.1.5:55579 PA / Raw
[2025-04-14 15:22:40] INFO - Received Packet-211: Ether / IP / TCP 172.65.235.85:5588 > 192.168.1.5:55579 PA / Raw
[2025-04-14 15:22:40] INFO - Received Packet-212: Ether / IP / TCP 172.65.235.85:5588 > 192.168.1.5:55579 PA / Raw
[2025-04-14 15:22:40] INFO - Received Packet-213: Ether / IP / TCP 172.65.235.85:5588 > 192.168.1.5:55579 A / Raw
[2025-04-14 15:22:40] INFO - Received Packet-214: Ether / IP / TCP 172.65.235.85:5588 > 192.168.1.5:55579 PA / Raw
[2025-04-14 15:22:40] INFO - Received Packet-215: Ether / IP / TCP 172.65.235.85:5588 > 192.168.1.5:55579 PA / Raw
[2025-04-14 15:22:40] INFO - Received Packet-216: Ether / IP / TCP 172.65.235.85:5588 > 192.168.1.5:55579 A / Raw
[2025-04-14 15:22:40] INFO - Received Packet-217: Ether / IP / TCP 172.65.235.85:5588 > 192.168.1.5:55579 PA / Raw
[2025-04-14 15:22:40] INFO - Received Packet-218: Ether / IP / TCP 172.65.235.85:5588 > 192.168.1.5:55579 A / Raw
[2025-04-14 15:22:40] INFO - Received Packet-219: Ether / IP / TCP 172.65.235.85:5588 > 192.168.1.5:55579 PA / Raw
[2025-04-14 15:22:40] INFO - Received Packet-220: Ether / IP / TCP 172.65.235.85:5588 > 192.168.1.5:55579 A / Raw
[2025-04-14 15:22:40] INFO - Received Packet-221: Ether / IP / TCP 172.65.235.85:5588 > 192.168.1.5:55579 PA / Raw
[2025-04-14 15:22:40] INFO - Received Packet-222: Ether / IP / TCP 172.65.235.85:5588 > 192.168.1.5:55579 A / Raw
[2025-04-14 15:22:40] INFO - Received Packet-223: Ether / IP / TCP 172.65.235.85:5588 > 192.168.1.5:55579 PA / Raw
[2025-04-14 15:22:40] INFO - Received Packet-224: Ether / IP / TCP 172.65.235.85:5588 > 192.168.1.5:55579 PA / Raw
[2025-04-14 15:22:40] INFO - Received Packet-225: Ether / IP / TCP 172.65.235.85:5588 > 192.168.1.5:55579 A / Raw
[2025-04-14 15:22:40] INFO - Received Packet-226: Ether / IP / TCP 172.65.235.85:5588 > 192.168.1.5:55579 PA / Raw
[2025-04-14 15:22:40] INFO - Received Packet-227: Ether / IP / TCP 172.65.235.85:5588 > 192.168.1.5:55579 A / Raw
[2025-04-14 15:22:40] INFO - Received Packet-228: Ether / IP / TCP 172.65.235.85:5588 > 192.168.1.5:55579 PA / Raw
[2025-04-14 15:22:40] INFO - Received Packet-229: Ether / IP / TCP 172.65.235.85:5588 > 192.168.1.5:55579 PA / Raw
[2025-04-14 15:22:40] INFO - Received Packet-230: Ether / IP / TCP 172.65.235.85:5588 > 192.168.1.5:55579 PA / Raw
[2025-04-14 15:22:40] INFO - Received Packet-231: Ether / IP / TCP 172.65.235.85:5588 > 192.168.1.5:55579 PA / Raw
[2025-04-14 15:22:40] INFO - Received Packet-232: Ether / IP / TCP 172.65.235.85:5588 > 192.168.1.5:55579 PA / Raw
[2025-04-14 15:22:40] INFO - Received Packet-233: Ether / IP / TCP 172.65.235.85:5588 > 192.168.1.5:55579 PA / Raw
[2025-04-14 15:22:40] INFO - Received Packet-234: Ether / IP / TCP 172.65.235.85:5588 > 192.168.1.5:55579 A / Raw
[2025-04-14 15:22:40] INFO - Received Packet-235: Ether / IP / TCP 172.65.235.85:5588 > 192.168.1.5:55579 PA / Raw
[2025-04-14 15:22:40] INFO - Received Packet-236: Ether / IP / TCP 172.65.235.85:5588 > 192.168.1.5:55579 A / Raw
[2025-04-14 15:22:40] INFO - Received Packet-237: Ether / IP / TCP 172.65.235.85:5588 > 192.168.1.5:55579 PA / Raw
[2025-04-14 15:22:40] INFO - Received Packet-238: Ether / IP / TCP 172.65.235.85:5588 > 192.168.1.5:55579 PA / Raw
[2025-04-14 15:22:40] INFO - Received Packet-239: Ether / IP / TCP 172.65.235.85:5588 > 192.168.1.5:55579 PA / Raw
[2025-04-14 15:22:40] INFO - Received Packet-240: Ether / IP / TCP 172.65.235.85:5588 > 192.168.1.5:55579 A / Raw
[2025-04-14 15:22:40] INFO - Received Packet-241: Ether / IP / TCP 172.65.235.85:5588 > 192.168.1.5:55579 PA / Raw
[2025-04-14 15:22:41] INFO - Received Packet-242: Ether / IP / TCP 172.65.235.85:5588 > 192.168.1.5:55579 PA / Raw
[2025-04-14 15:22:41] INFO - Received Packet-243: Ether / IP / TCP 172.65.235.85:5588 > 192.168.1.5:55579 PA / Raw
[2025-04-14 15:22:48] INFO - Received Packet-244: Ether / IP / TCP 172.65.235.85:5588 > 192.168.1.5:55579 PA / Raw
[2025-04-14 15:22:48] INFO - Received Packet-245: Ether / IP / TCP 172.65.235.85:5588 > 192.168.1.5:55579 A / Raw
[2025-04-14 15:22:48] INFO - Received Packet-246: Ether / IP / TCP 172.65.235.85:5588 > 192.168.1.5:55579 PA / Raw
[2025-04-14 15:22:48] INFO - Received Packet-247: Ether / IP / TCP 172.65.235.85:5588 > 192.168.1.5:55579 PA / Raw
[2025-04-14 15:22:48] INFO - Received Packet-248: Ether / IP / TCP 172.65.235.85:5588 > 192.168.1.5:55579 PA / Raw
[2025-04-14 15:22:48] INFO - Received Packet-249: Ether / IP / TCP 172.65.235.85:5588 > 192.168.1.5:55579 PA / Raw
[2025-04-14 15:22:48] INFO - Received Packet-250: Ether / IP / TCP 172.65.235.85:5588 > 192.168.1.5:55579 A / Raw
[2025-04-14 15:22:48] INFO - Received Packet-251: Ether / IP / TCP 172.65.235.85:5588 > 192.168.1.5:55579 PA / Raw
[2025-04-14 15:22:49] INFO - Received Packet-252: Ether / IP / TCP 172.65.235.85:5588 > 192.168.1.5:55579 PA / Raw
[2025-04-14 15:22:49] INFO - Received Packet-253: Ether / IP / TCP 172.65.235.85:5588 > 192.168.1.5:55579 PA / Raw
[2025-04-14 15:22:49] INFO - Received Packet-254: Ether / IP / TCP 172.65.235.85:5588 > 192.168.1.5:55579 PA / Raw
[2025-04-14 15:22:50] INFO - Received Packet-255: Ether / IP / TCP 172.65.235.85:5588 > 192.168.1.5:55579 PA / Raw
[2025-04-14 15:22:50] INFO - Received Packet-256: Ether / IP / TCP 172.65.235.85:5588 > 192.168.1.5:55579 PA / Raw
[2025-04-14 15:22:50] INFO - Received Packet-257: Ether / IP / TCP 172.65.235.85:5588 > 192.168.1.5:55579 PA / Raw
[2025-04-14 15:22:50] INFO - Received Packet-258: Ether / IP / TCP 172.65.235.85:5588 > 192.168.1.5:55579 PA / Raw
[2025-04-14 15:22:50] INFO - Received Packet-259: Ether / IP / TCP 172.65.235.85:5588 > 192.168.1.5:55579 PA / Raw
[2025-04-14 15:22:50] INFO - Received Packet-260: Ether / IP / TCP 172.65.235.85:5588 > 192.168.1.5:55579 PA / Raw
[2025-04-14 15:22:50] INFO - Received Packet-261: Ether / IP / TCP 172.65.235.85:5588 > 192.168.1.5:55579 A / Raw
[2025-04-14 15:22:50] INFO - Received Packet-262: Ether / IP / TCP 172.65.235.85:5588 > 192.168.1.5:55579 PA / Raw
[2025-04-14 15:22:50] INFO - Received Packet-263: Ether / IP / TCP 172.65.235.85:5588 > 192.168.1.5:55579 PA / Raw
[2025-04-14 15:22:50] INFO - Received Packet-264: Ether / IP / TCP 172.65.235.85:5588 > 192.168.1.5:55579 PA / Raw
[2025-04-14 15:22:53] INFO - Received Packet-265: Ether / IP / TCP 172.65.235.85:5588 > 192.168.1.5:55579 PA / Raw
[2025-04-14 15:22:55] INFO - Received Packet-266: Ether / IP / TCP 172.65.235.85:5588 > 192.168.1.5:55579 PA / Raw
[2025-04-14 15:22:55] INFO - Received Packet-267: Ether / IP / TCP 172.65.235.85:5588 > 192.168.1.5:55579 PA / Raw
[2025-04-14 15:22:55] INFO - Received Packet-268: Ether / IP / TCP 172.65.235.85:5588 > 192.168.1.5:55579 A / Raw
[2025-04-14 15:22:55] INFO - Received Packet-269: Ether / IP / TCP 172.65.235.85:5588 > 192.168.1.5:55579 PA / Raw
[2025-04-14 15:22:55] INFO - Received Packet-270: Ether / IP / TCP 172.65.235.85:5588 > 192.168.1.5:55579 PA / Raw
[2025-04-14 15:22:57] INFO - Received Packet-271: Ether / IP / TCP 172.65.235.85:5588 > 192.168.1.5:55579 PA / Raw
[2025-04-14 15:22:57] INFO - Received Packet-272: Ether / IP / TCP 172.65.235.85:5588 > 192.168.1.5:55579 PA / Raw
[2025-04-14 15:22:57] INFO - Received Packet-273: Ether / IP / TCP 172.65.235.85:5588 > 192.168.1.5:55579 A / Raw
[2025-04-14 15:22:57] INFO - Received Packet-274: Ether / IP / TCP 172.65.235.85:5588 > 192.168.1.5:55579 PA / Raw
[2025-04-14 15:22:57] INFO - Received Packet-275: Ether / IP / TCP 172.65.235.85:5588 > 192.168.1.5:55579 PA / Raw
[2025-04-14 15:22:59] INFO - Received Packet-276: Ether / IP / TCP 172.65.235.85:5588 > 192.168.1.5:55579 PA / Raw
[2025-04-14 15:22:59] INFO - Received Packet-277: Ether / IP / TCP 172.65.235.85:5588 > 192.168.1.5:55579 PA / Raw
[2025-04-14 15:22:59] INFO - Received Packet-278: Ether / IP / TCP 172.65.235.85:5588 > 192.168.1.5:55579 A / Raw
[2025-04-14 15:22:59] INFO - Received Packet-279: Ether / IP / TCP 172.65.235.85:5588 > 192.168.1.5:55579 PA / Raw
[2025-04-14 15:22:59] INFO - Received Packet-280: Ether / IP / TCP 172.65.235.85:5588 > 192.168.1.5:55579 PA / Raw
