[2025-04-14 13:43:16] INFO - Started sniffing.
[2025-04-14 13:43:19] INFO - Received Packet-1: Ether / IP / TCP 172.65.235.85:5588 > 192.168.1.5:54522 PA / Raw
[2025-04-14 13:43:20] INFO - Received Packet-2: Ether / IP / TCP 172.65.235.85:5588 > 192.168.1.5:54522 PA / Raw
[2025-04-14 13:43:20] INFO - Received Packet-3: Ether / IP / TCP 172.65.235.85:5588 > 192.168.1.5:54522 PA / Raw
[2025-04-14 13:43:20] INFO - Received Packet-4: Ether / IP / TCP 172.65.235.85:5588 > 192.168.1.5:54522 PA / Raw
[2025-04-14 13:43:22] INFO - Received Packet-5: Ether / IP / TCP 172.65.235.85:5588 > 192.168.1.5:54548 PA / Raw
[2025-04-14 13:43:22] INFO - Received Packet-6: Ether / IP / TCP 172.65.235.85:5588 > 192.168.1.5:54548 PA / Raw
[2025-04-14 13:43:22] INFO - Received Packet-7: Ether / IP / TCP 172.65.235.85:5588 > 192.168.1.5:54548 PA / Raw
[2025-04-14 13:43:22] INFO - Received Packet-8: Ether / IP / TCP 172.65.235.85:5588 > 192.168.1.5:54548 PA / Raw
[2025-04-14 13:43:23] INFO - Received Packet-9: Ether / IP / TCP 172.65.235.85:5588 > 192.168.1.5:54548 PA / Raw
[2025-04-14 13:43:23] INFO - Received Packet-10: Ether / IP / TCP 172.65.235.85:5588 > 192.168.1.5:54548 PA / Raw
[2025-04-14 13:43:24] INFO - Received Packet-11: Ether / IP / TCP 172.65.235.85:5588 > 192.168.1.5:54548 PA / Raw
[2025-04-14 13:43:24] INFO - Received Packet-12: Ether / IP / TCP 172.65.235.85:5588 > 192.168.1.5:54548 PA / Raw
[2025-04-14 13:43:24] INFO - Received Packet-13: Ether / IP / TCP 172.65.235.85:5588 > 192.168.1.5:54548 A / Raw
[2025-04-14 13:43:24] INFO - Received Packet-14: Ether / IP / TCP 172.65.235.85:5588 > 192.168.1.5:54548 PA / Raw
[2025-04-14 13:43:24] INFO - Received Packet-15: Ether / IP / TCP 172.65.235.85:5588 > 192.168.1.5:54548 PA / Raw
[2025-04-14 13:43:25] INFO - Received Packet-16: Ether / IP / TCP 172.65.235.85:5588 > 192.168.1.5:54548 PA / Raw
[2025-04-14 13:43:25] INFO - Received Packet-17: Ether / IP / TCP 172.65.235.85:5588 > 192.168.1.5:54548 A / Raw
[2025-04-14 13:43:25] INFO - Received Packet-18: Ether / IP / TCP 172.65.235.85:5588 > 192.168.1.5:54548 PA / Raw
[2025-04-14 13:43:25] INFO - Received Packet-19: Ether / IP / TCP 172.65.235.85:5588 > 192.168.1.5:54548 PA / Raw
[2025-04-14 13:43:25] INFO - Received Packet-20: Ether / IP / TCP 172.65.235.85:5588 > 192.168.1.5:54548 PA / Raw
[2025-04-14 13:43:25] INFO - Received Packet-21: Ether / IP / TCP 172.65.235.85:5588 > 192.168.1.5:54548 PA / Raw
[2025-04-14 13:43:25] INFO - Received Packet-22: Ether / IP / TCP 172.65.235.85:5588 > 192.168.1.5:54548 PA / Raw
[2025-04-14 13:43:25] INFO - Received Packet-23: Ether / IP / TCP 172.65.235.85:5588 > 192.168.1.5:54548 PA / Raw
[2025-04-14 13:43:25] INFO - Received Packet-24: Ether / IP / TCP 172.65.235.85:5588 > 192.168.1.5:54548 PA / Raw
[2025-04-14 13:43:25] INFO - Received Packet-25: Ether / IP / TCP 172.65.235.85:5588 > 192.168.1.5:54548 PA / Raw
[2025-04-14 13:43:25] INFO - Received Packet-26: Ether / IP / TCP 172.65.235.85:5588 > 192.168.1.5:54548 PA / Raw
[2025-04-14 13:43:25] INFO - Received Packet-27: Ether / IP / TCP 172.65.235.85:5588 > 192.168.1.5:54548 PA / Raw
[2025-04-14 13:43:25] INFO - Received Packet-28: Ether / IP / TCP 172.65.235.85:5588 > 192.168.1.5:54548 PA / Raw
[2025-04-14 13:43:25] INFO - Received Packet-29: Ether / IP / TCP 172.65.235.85:5588 > 192.168.1.5:54548 PA / Raw
[2025-04-14 13:43:25] INFO - Received Packet-30: Ether / IP / TCP 172.65.235.85:5588 > 192.168.1.5:54548 PA / Raw
[2025-04-14 13:43:25] INFO - Received Packet-31: Ether / IP / TCP 172.65.235.85:5588 > 192.168.1.5:54548 PA / Raw
[2025-04-14 13:43:25] INFO - Received Packet-32: Ether / IP / TCP 172.65.235.85:5588 > 192.168.1.5:54548 PA / Raw
[2025-04-14 13:43:25] INFO - Received Packet-33: Ether / IP / TCP 172.65.235.85:5588 > 192.168.1.5:54548 PA / Raw
[2025-04-14 13:43:25] INFO - Received Packet-34: Ether / IP / TCP 172.65.235.85:5588 > 192.168.1.5:54548 PA / Raw
[2025-04-14 13:43:25] INFO - Received Packet-35: Ether / IP / TCP 172.65.235.85:5588 > 192.168.1.5:54548 PA / Raw
[2025-04-14 13:43:25] INFO - Received Packet-36: Ether / IP / TCP 172.65.235.85:5588 > 192.168.1.5:54548 PA / Raw
[2025-04-14 13:43:25] INFO - Received Packet-37: Ether / IP / TCP 172.65.235.85:5588 > 192.168.1.5:54548 PA / Raw
[2025-04-14 13:43:25] INFO - Received Packet-38: Ether / IP / TCP 172.65.235.85:5588 > 192.168.1.5:54548 PA / Raw
[2025-04-14 13:43:25] INFO - Received Packet-39: Ether / IP / TCP 172.65.235.85:5588 > 192.168.1.5:54548 PA / Raw
